{
  "policyVersion": "candidate-authority-source-policy/5.0.0",
  "status": "accepted-pre-live-source-rule-authority-live-not-authorized",
  "bindings": {
    "catalogVersion": "public-v1",
    "catalogDigest": "4819dd94cb1bbe5e27c31ca5ca55976da1442987a792bf438d96681021cb8634",
    "phase8ProviderPolicyVersion": "profile-materialization-provider-policy/1.0.0",
    "phase8ProviderPolicyDigest": "0945ebd862d0a1b5f622c4f10f60b2c0e713fb127cc5dea5668be5cc40c96ede",
    "historicalSourcePolicyVersion": "candidate-authority-source-policy/1.0.0",
    "historicalSourcePolicyDigest": "b0f22107190995b64f81851f8d88b8da6539643868ee93ba9977b262b0bc3699",
    "proposedSourcePolicyVersion": "candidate-authority-source-policy/2.0.0",
    "proposedSourcePolicyDigest": "99ef0fd9631eede0548e3f1a3ae32a1f17be0f9ecb95ef9b29e3a831bf053e50",
    "fieldPlanVersion": "candidate-authority-field-plan/4.0.0",
    "fieldPlanDigest": "84796407204bdb7f08efd053b71afc169312e22af2f104fca23d7e8581cb5997",
    "correctedSourcePolicyVersion": "candidate-authority-source-policy/3.0.0",
    "correctedSourcePolicyDigest": "946862b5b9291023f11d3bb7d37bf3d99a84d40d8846a361dba87ebc0b8614bb",
    "priorSourcePolicyVersion": "candidate-authority-source-policy/4.0.0",
    "priorSourcePolicyDigest": "5b4fe3b3752679ed1302ce242ededf41b59ea54d01a7f020dad3027635208793"
  },
  "authorization": {
    "liveCollectionAuthorized": false,
    "credentialReadAuthorized": false,
    "providerCallAuthorized": false,
    "allCandidateProjectionAuthorized": false,
    "coverageCalculationAuthorized": false,
    "automaticRerunAuthorized": false
  },
  "requestBudget": {
    "candidateCount": 150,
    "mappedPackageCount": 80,
    "githubLogicalRequests": 1810,
    "npmLogicalRequests": 80,
    "totalLogicalRequests": 1890,
    "githubWorstCaseAttempts": 5430,
    "npmWorstCaseAttempts": 240,
    "totalWorstCaseAttempts": 5670
  },
  "operations": [
    {
      "operationId": "github-repository-metadata",
      "provider": "github",
      "host": "api.github.com",
      "method": "GET",
      "endpointShape": "/repos/{owner}/{repository}",
      "authentication": "later-authorized injected bearer token; never retained",
      "sourceMutability": "mutable",
      "maximumRequestsPerCandidate": 1,
      "paginationRule": "none",
      "maximumResponseBytes": 2097152,
      "maximumJsonNodes": 100000,
      "timeoutMilliseconds": 15000,
      "maximumAttempts": 3,
      "redirectPolicy": "zero redirects",
      "controlledAbsence": "fatal identity failure; never a negative field claim",
      "temporaryUnavailability": "fatal-run failure",
      "retainedStructuredProperties": [
        "archived",
        "default_branch",
        "full_name",
        "id",
        "language"
      ],
      "fieldsSupplied": ["archived-state", "language-ecosystem"],
      "privacySecurity": "Public structured metadata only; descriptions, topics, authorization headers, and raw bodies are not committed.",
      "evidenceProvenance": "structured-provider-snapshot/repository-metadata",
      "completenessSemantics": "Exact identity supplies a total archived Boolean at collectedAt. A recognized non-null primary language supplies one partial language/ecosystem fact; null or unsupported values remain unknown.",
      "maximumTotalLogicalRequests": 150
    },
    {
      "operationId": "github-default-branch-ref",
      "provider": "github",
      "host": "api.github.com",
      "method": "GET",
      "endpointShape": "/repos/{owner}/{repository}/git/ref/heads/{urlEncodedDefaultBranch}",
      "authentication": "later-authorized injected bearer token; never retained",
      "sourceMutability": "mutable branch reference resolved to an immutable commit object ID",
      "maximumRequestsPerCandidate": 1,
      "paginationRule": "none",
      "maximumResponseBytes": 262144,
      "maximumJsonNodes": 10000,
      "timeoutMilliseconds": 10000,
      "maximumAttempts": 3,
      "redirectPolicy": "zero redirects",
      "controlledAbsence": "fatal identity failure",
      "temporaryUnavailability": "fatal-run failure",
      "retainedStructuredProperties": ["ref", "object.type", "object.sha"],
      "fieldsSupplied": ["deployment-self-hosting", "maintenance-activity"],
      "privacySecurity": "Public Git reference identity only; no raw body is retained.",
      "evidenceProvenance": "intermediate exact-head identity binding; evidence uses the validated commit object",
      "completenessSemantics": "The ref must exactly equal refs/heads/{defaultBranch}, its object type must be commit, and its SHA becomes the only allowed commit-object request identity.",
      "maximumTotalLogicalRequests": 150
    },
    {
      "operationId": "github-head-commit-object",
      "provider": "github",
      "host": "api.github.com",
      "method": "GET",
      "endpointShape": "/repos/{owner}/{repository}/git/commits/{exactCommitObjectId}",
      "authentication": "later-authorized injected bearer token; never retained",
      "sourceMutability": "immutable Git commit object selected by the validated branch reference",
      "maximumRequestsPerCandidate": 1,
      "paginationRule": "none",
      "maximumResponseBytes": 262144,
      "maximumJsonNodes": 10000,
      "timeoutMilliseconds": 10000,
      "maximumAttempts": 3,
      "redirectPolicy": "zero redirects",
      "controlledAbsence": "fatal identity failure",
      "temporaryUnavailability": "fatal-run failure",
      "retainedStructuredProperties": [
        "sha",
        "tree.sha",
        "author.date",
        "committer.date"
      ],
      "fieldsSupplied": ["deployment-self-hosting", "maintenance-activity"],
      "privacySecurity": "Public commit and root-tree identity plus dates only; no diff, files array, message, author identity, email, or raw body is retained.",
      "evidenceProvenance": "git-commit or structured-provider-snapshot/repository-maintenance",
      "completenessSemantics": "The commit SHA must equal the reference object SHA. The bounded commit object supplies the immutable head SHA and root tree SHA under ADR 0006 semantics.",
      "maximumTotalLogicalRequests": 150
    },
    {
      "operationId": "github-maintenance-window",
      "provider": "github",
      "host": "api.github.com",
      "method": "GET",
      "endpointShape": "/repos/{owner}/{repository}/commits?sha={headSha}&since={cutoffMinus90Days}&until={cutoff}&per_page=1&page=1",
      "authentication": "later-authorized injected bearer token; never retained",
      "sourceMutability": "mutable query bound to immutable head and closed time window",
      "maximumRequestsPerCandidate": 1,
      "paginationRule": "per_page=1; a valid Link last-page number proves the count, no Link with zero or one result proves 0 or 1, and every other state is qualified unknown",
      "maximumResponseBytes": 2097152,
      "maximumJsonNodes": 100000,
      "timeoutMilliseconds": 15000,
      "maximumAttempts": 3,
      "redirectPolicy": "zero redirects",
      "controlledAbsence": "a complete empty result is established zero commits",
      "temporaryUnavailability": "qualified field unknown",
      "retainedStructuredProperties": [
        "query.headSha",
        "query.since",
        "query.until",
        "count",
        "paginationClosure"
      ],
      "fieldsSupplied": ["maintenance-activity"],
      "privacySecurity": "No commit messages or contributor personal data are retained.",
      "evidenceProvenance": "structured-provider-snapshot/repository-maintenance",
      "completenessSemantics": "Only a closed-window pagination state establishes an exact count, including zero.",
      "maximumTotalLogicalRequests": 150
    },
    {
      "operationId": "github-license",
      "provider": "github",
      "host": "api.github.com",
      "method": "GET",
      "endpointShape": "/repos/{owner}/{repository}/license?ref={headSha}",
      "authentication": "later-authorized injected bearer token; never retained",
      "sourceMutability": "immutable commit-qualified",
      "maximumRequestsPerCandidate": 1,
      "paginationRule": "none",
      "maximumResponseBytes": 2097152,
      "maximumJsonNodes": 100000,
      "timeoutMilliseconds": 15000,
      "maximumAttempts": 3,
      "redirectPolicy": "zero redirects",
      "controlledAbsence": "established no detected license, but license identity remains unknown because the value type has no absence variant",
      "temporaryUnavailability": "qualified field unknown",
      "retainedStructuredProperties": [
        "license.spdx_id",
        "path",
        "sha",
        "repositoryIdentity",
        "headSha"
      ],
      "fieldsSupplied": ["license-identity"],
      "privacySecurity": "Public structured classification, safe repository-relative license path, and provider Git blob identity only; license content, raw response, download or temporary URLs, and authorization headers are not retained.",
      "evidenceProvenance": "git-commit",
      "completenessSemantics": "A recognized non-NOASSERTION SPDX value with an exact safe provider-returned repository path supplies one positive license fact and immutable locator; non-detection remains unknown and no path is inferred.",
      "maximumTotalLogicalRequests": 150
    },
    {
      "operationId": "github-community-profile",
      "provider": "github",
      "host": "api.github.com",
      "method": "GET",
      "endpointShape": "/repos/{owner}/{repository}/community/profile",
      "authentication": "later-authorized injected bearer token; never retained",
      "sourceMutability": "mutable",
      "maximumRequestsPerCandidate": 1,
      "paginationRule": "none",
      "maximumResponseBytes": 2097152,
      "maximumJsonNodes": 100000,
      "timeoutMilliseconds": 15000,
      "maximumAttempts": 3,
      "redirectPolicy": "zero redirects",
      "controlledAbsence": "qualified unknown unless a successful payload supplies the complete security_policy Boolean",